{
  "status": "complete",
  "packets_read": 688,
  "snippets_found": 1178,
  "total_skeletons": 1178,
  "skeletons_written": 1178,
  "batches_written": 48,
  "batch_size": 25,
  "last_batch_written": 48,
  "issues": [],
  "input_fingerprint": "79b5bce02804c6c959a75a090ad6024d15f0c5944b02297af3b3acb790bdcdaa",
  "started_at": "2026-04-21T00:30:29.491694+00:00",
  "completed_at": "2026-04-21T00:30:29.641683+00:00"
}